{
  "contract_version": "company-delivery-handoff/v1",
  "operator_version": "1.2.0",
  "created_at": "2026-08-16T08:00:00Z",
  "source": {
    "repository": "admin/aisoft-platform",
    "git_sha": "0000000000000000000000000000000000000000",
    "transport": "approved-bundle"
  },
  "release": {
    "contract_version": "docker-release/v2",
    "release_id": "0000000000000000000000000000000000000000",
    "manifest_path": "release/release.json",
    "manifest_sha256": "0000000000000000000000000000000000000000000000000000000000000000",
    "platform": "linux/amd64",
    "transport": "offline-bundle"
  },
  "compatibility": {
    "matrix_path": "operator/compatibility/newemaint-company-pilot-v1.json",
    "matrix_sha256": "0000000000000000000000000000000000000000000000000000000000000000",
    "required_roles": [
      "scm-ci",
      "appserver-prod"
    ]
  },
  "payloads": [
    {
      "path": "operator/VERSION",
      "sha256": "0000000000000000000000000000000000000000000000000000000000000000",
      "size_bytes": 6,
      "mode": "0644"
    }
  ]
}
